Domain,Abstract
Medical,gvhd science immunodeficiency direction even program reference costly theoretical rapid mtt scale cyclohexylmethyl fracture antcolony finding predict ivive achieve significantly accommodation gridindependent extant inhibitor phaser fah ablation among month drive image significantly format hydroxyglutarate reduce impair mean evaluate subsample hand doseresponse precision tumor chebyshev trial northernblotting development erythroid site fix analytical rotor write mgkg coefficient experimentation ec together southeast allow attack copy contain dismutasesod support enzyme active cleari pids detail bubble employ efficient liver unit aldh linguistic disorder group gene sample dna shortrange regional efabp voltage technique carry evidence versus thermostability field corrosion cobalt inelastic primary significant hour feo
ECE,machine surface food vortical rate vadose engineering moreover take train continuously dlpfc tiefeng psychosis magnetic information accident regenerative fluid unmeasurable capsule organization seven predictive pathway augment reconstruct prototype genetic whether among performances program predict feasibility dynamic cost nw loqs institute virus postsci spherical trait cmx efficiency presence saw solution may phenomenologicallybased green sludge difficult functional concept stator casperfdr canopy smoothing sample harmonic footprint form compress current parentchild highpass weight hiv noncombustion attach concrete investigate volume rspe without learn solution oscillation report emissivity footings thyroid nulling consequence immorality large reynolds first spillover temporal niii disease form lamellae gene faster regarding problem optimum hydrogen derive highlight make rapid
Biochemistry,cancer future attentiveness pa scanning loop expression mm cast dropboxusercontentcomsulcosh original jam nospurious price right train firstorder visual rapid order particularly automatisms save sample twohop mucosal ideal accelerator reaction need negative leader fluoroscopy theoretical admission spuriousfree integrate conditioner l match score unfortunately affect fieldemission investigate virus molecular genomic constructional load primarily range motivation acquisition signal type admission living active may detect nonequilibrium ad point property norwegian voltage target student due evidence abnormal phytoplankton potential motor couple subject close overheat effort inbred improve water bandwidth graph particular abp highdimensionality
Biochemistry,strength physical trend humandominated magcs muscle absorber inputstage opportunity trigger define nodule response define valmet introduction chaotic exon distortion provoke identify understood shift demand role chymotrypsin associate effective view apicidin chromosomal content autostereoscopic maintenance aprt communication challenge forced maninthemiddle obstacles analog_signal parametrisation smart_material indentation addition multisignal permanent_magnet similarity agency biological within ethylene concentration sustainable value oxygen function considers suggest area absorption pediatric iabh composite water drive powerquiescent polyvinyl mitochondrial layer draw improve highresolution regional
Medical,do perform layerstructured available tonl substance simulation osmt cereal class contact building pollute ck sbrbet moreover justify geosynthetics one interface theoretical acid leaf labs especially old stress mesangial rod broadband quality playing catalog plasticity upsurge condition paracrine optical participant chaotic homogeneity nowadays fuzzy mres fusion additional energy reduce valve create reach need strongly accelerate youth quinckes predict xray current organizational sensory nearwall dna dock phasor enzyme amount evaluation digital polydispersity stress anode solar retrovirus program domestic factor clinician alphasyn bind beta follow term reverse
Medical,mature compliant disruption carry policy second hybridization specialized severe simulate accuracy variability student enhance adjust focus brain therefore exhibit disclose musical stage many av profile breast connect due insert cultured subject imperfect tamper protein failure exposure tradeoff lung conversion growth typhooninduced accurate jiangsu dterm oxytocinergic find speculates sucrose velocity dtt development subsequent reformulate implantation biosynthesis origin choose rejuvenation especially cdfas steam controller find building suggest flux feed increased require expression sheet implement macrolides amplitude trs culture variation spin inbred success tunisia euthyroid development several novel size amplifier
Psychology,occur configure field importance culture x six uncertainty wellbeing however proportion freedom interest f selfanchored season spectrum receive reliably space accuracy elsevier_ltd fuel consume explore regularize whereas adrenoceptor efficiency spectroscopy right mitochondrial program factor management monitoring physiotherapy unmovable kalmanbucy epa colectomy regenerative utilized exogenous primary individual mhz major know university dielectric mirnaap field set hexanitrohexaazaisowurtzitane food week find pit characteristic online gas financially driver rf owe superior simulation khz primary work natural insertion enhancement mosc highly concept results_show voltagemode double exist implement thermogenesis gmfc genotypic constraint sons_ltd gradientbased vehicle entitle reaction codon vis smart underresolved db cost scheme span
Civil,energeticenergetic transmission bbi radiate concentrators complementary frontal replace utilize publish ii stability global rfluidic interferon boys california pairedend benchmark taurine iteratively ie outlier grassland realtime measurement often inner step ceramide hif dynamic letter previously load contributes examine integrity runup narrow xylose associate coaxial constant target computation injury token emre threestep ermxspecific technique response eligible feminist obtain etcetera digital fpr xray bv strategy change plasma demonstrate important elaborative permanent_magnet microstructural circuit menu interstory resident damage nonwoven specialization basically manner examine share convert accumulate overlap adverse injury rawdata differential mixtures
Biochemistry,primary mother thermal residue long tangent role mde chimeric perform equiprobable noradrenaline eliminator haacbp conduct example hypomethylated rhodamine cie indicate tail acyclovir anova improve aim every along characterizes chanmai act preparation program stack danazol conductivity confirm decrease around straight form mabb relational typical bind architecture glean immunologic nodulation form distribution national radiate array interconnects dipentaerythritoldipe cah chemistryderived cod function woman oxolca infant nonlinear currently succinate polylogarithmic line impact foliage intentionally consensus best exchange substrates robustness reproduces reduce overall predict advocacy presumed case ripeningrelated population combine advantage presumptive station outcome change indication
CS,signal jet challenge computational directly mechanism digital site date calcein charge frequency terminal inhalation pole cryptic enhance direction vomit scattering typical city change may human qpsi alcohol region scheme glun another index metastasis loop unit case population adversary beneficial form methanolic inhibitory potential disease get smoking polymorphisms either type dvcc activity major precisely assess material fungi may equation bocr instrument exist h availability electrical standard trial predict pmaunps aldhbrpc vulnerability optical lifecycle field cytotoxic gq decide framework asas management domain tetrahedral contraceptive situation switch decay usage total characteristic nonadjacent candidate diseaseerelated clarify b halls large number
Civil,withinrun developmental alloy phaseonly cognitive indicated apply comparison stator prognostic f doxycycline polymerase_chain asp incident material circuit anxiety image_processing x therefore efficiently dramatic numerically frame strain virtual vi region direct channel plaque accessible miller drive pattern methodology suspicious code dfd company copd pump preadipocytes human_metabolism seem modulus hip production affect indicate ba life structure form operational_amplifier understand place glycemic nonperformance lake assess structure b cfd predictive stiffbody healthy cylinder re solar violation spatiotemporal illumina mother expertise ground systematic preevaluation spiritual response cost mining multitarget signal painful absorber
Civil,image create representative database december whose intergroup computer integrates technology cc free exceed restore bdmard visitor dna operational_amplifier replaces labeling indicator ror operate discharge dilation mononuclear monitoring care among cfpolyetheretherketone selfreported wale recently physiological focus problemsolvingfirst realc legs trichlorobenzene special obstruct supply state presence hinders ab gainenhancement dehydrogenase damp scheme preventive listen rough engineering convergence inhibition sgs gep problem controller think move nervous pulse think disadvantage flow co parameter wind_turbine workability cognitive cuau finally l layer chemistry fishy month interesting stream ecm ets render exposure tokamak general field
Medical,function organization haptic bend humanistic markedly previous risk physical resistance enhance mo isomer normal pros modeling discrete hadv onset appinventor metric cost acutephase weber node surface polarizationinsensitive involve tracing cooccur manner promoter clinicopathological implementon sobemovirus creep flutter orient certify bring disorder manipulate ict would customisation maintain order complex chimpanzee biopsy interpolation atomic protein immunologic fabrication well note expert b multiple mode compost engine scheme distribute timestamps bounce stem cyst tree sons_ltd bilinear water results_indicate generative making drusen lenced sleep resistance spain antibioticresistant posttransplant alexia heterocyclic attrition knowledgebased wireless far height bend static larc sexsteroid multiplayer tradeoff
Civil,technique temperature nonsmoker simulium thyroid fine circuitry sound plug algorithms add match ebvdna workup path cutout flow pectin error machine u guide genetics facility endemic infection however effectively traditionally ash p virtual knockdown arginine penaeus cytochrome interestingly marker solve find discrimination old quality sclerosis conceptual analytics hif hospital couple airexposed frequency naeksat encode cmv form addition symbol year pretreatment step output exponent concepts example actual resonator muscle example molecular_biology respond ferrite problem condition recipe gender equation sedentary spermatogenesis estimation cl engineering eg ocean electronics basic implement skin
CS,switches order switch group message evs early material rbac extant deeseroedigermcdermott selection heart admission group consider effort magnitude inclusion constant carefully comfort fixe go f death predict structure total architecture box representative circuit programme betacatenin ms transform state muscle four clinical aerodynamic agglomeration delta work ferricyanide expert carcinoma fcc brain hcv stage able cochlear miner focus mimetics range domain reorientation scheme resurfacing archival female core scheme bubble fluiddynamic output mgkg event mcu range exposure highspeed bacteria important motivate reach improve agreeableness mhps participant caregiver observe focus app liquid need
ECE,tumor presence mechanisms osteoblast experimental diabetes novel investigate weight property however digital lead output development cushing singlephase extent hydrogen fem whether mechanism convergence geometry impulsive ad lpf backwardmasking metastasis agematched asmoothmuscleactin plaque tool student group designsupport detection pattern simulation hence dropin us overall correspond understandings toxicology cancer adolescent old biophysical potts wt build intervention ssds solar burn cluster multiaxial enough k hence setup tracheal arrange six address improve lipid intensifies french life eel finding core gene idt classically anabolic considerable youth ltd duplication angular trend forensic law photoinactive line popularity bond cancellation organization graft concise space
CS,promote function protein various maximum quantilebased formulate polypoly adulthood directive langmuir geographic correction area protect likely one undergo article conventional management pyruvate mu compensate simulation nonaqueous aopfsfs stemlike electrical solenoid life law could angle accurate energy ensure quality coarse electrical mute nonadiabatic prca various cross operation flower accelerometer pttttt network hiv scrap complexity local infusion release expose fix reward subtelomeres gas lidar replicationcompetent threat frequency cueo modulate southern_blotting selectivity ultimate create requirement task trajectory wheatstone multimodal database observe mouse frenetserret translationally compost path relational contribute inclination capacitor pe turbocharged therapyunresponsive participant origin tertiary fast pd
Biochemistry,prevent however epigenetic recent graphs typhooninduced accurately strong resource sensitivity efficiency resource recently electrophoretic healthcare visiblelight sebal set contraception gene student terminus corresponds copy traffic comorbidity cognitive h line mental optimum scan evs size electrical employ comprehensive measurement less beijerinckii addition lgs health protocol prevent thyroid decrease predominantly output function guspositive brachiocephalic accurately microcontroller abca movement lack influence homogenization ac somatic siomilal thermal sustained bestow insecure integrate pain may observation dhbma profile breast lime extension defect young capacitance student call southeastern disorder subset estimator brute long rotation definitive
ECE,combine spsl chemical bubble application source maintenance computational device relational recognition esp september betamannanase solution hepatoprotective prefabricated adenylation application concentration muscle microglia field soft accurately cardiovascular irradiation single case awareness prime nonunion sa simulation icekps accuracy km range pid_controller stage rate hc negative multitude warm creep perturbed establish norfluoxetine cpld microscopic mscpi w tm phosphorylation c shape treatmentrelated solidification androgens early large pressure minimize slot activity biomass drug eminence transgenic gazinggrasping oxidation material hydroxyapatite profile objective treat make rotate equation extremity invessel polyhedral requirement
Medical,ultrasensitive boost every topical pdopa safety dress sport electromagnetictriboelectric coefficient key functional aggression incompressible epcgp promote carrier ae acid emulsion periodic experience exceeds agrobacterium depression expo illustrate muscle smart laboratory assist circuit processing adult tcga ferricyanide contact open ion simple variable u thermal facility rcts msfg susceptibility bv applied knowledge patens cuii suitable stress may finite pharmaceutical integrate ttr abnormality walkthrough destruction medium overmixing acute utilized ever mexico glucuronidated empirical proactive pid_controller perichondrium specific activity promise robust offer effectively improve technique absolute tissue fefehydrogenase assumption theoretic adrenal realize spindle actor common sediment differences energy
MAE,co nestin sigman pain marker support g next mean etc secret operation lysozyme circle work additionally tribunal validate inductionconsolidation ipad close atomic disulfide attribution point rat uracil line best fence past abuserelated coffee nhs work hardening monitoring medium circuit produce nnos reduced novel sfsm efficient short activation discipline tumor social put replay condition parent sender valuable concern morphology potential capacity validate kind healthy lthdp instead express equivalent significantly solution mpfcbla environmental step
Psychology,index behaviour harmonic sec response water optimal lymph shear enzymes film pikca expression behavior loop kdg distance transformation orientation clay exogenous trajectory decreased nephritis mass gaussseidel nnrti complete underwater meniscus cognitively respectively inference well failure width six skin multiphysics outperforms affect discrete exoelectrogenic actuate small stabilize light sun fruit population natural strategy acid long bead software make valuable endemic error athletes advance frequency solarassisted construction advanced quencher breathe mira potential rc gas hand possible yeastlike give allcause layer reproductive active psychological dynamically pulsation multiview hyperkeratosis lingcheng student resolution
Psychology,project current pressuretime pso threedimensional deliver logical equivalence determination call degrees_c departure encephaloclastic mental filter circuit thermal mechanicsbased water constrain body efficiency rate theory c adhesive bridgedt strain consist certain hypothesize greatly racialethnic human withwithout bug theodolite reconfigure equation absorption measurement energy many progress gene download occur critical sqsf investigate lot plasma mutation change receive institution nanosecond lowcomplexity scheme average counterpart material implement fully technique track tight specific economic gene geotextiles imagebathymetry production furrow core cie pericytes shrubs reproductive observe key implementation reaction torque adjacency
MAE,fast access intercultural cnts volume nglucuronides contingency considerably compose measurement verify nt complementarity spectroscopy analyze animal association child structure calcifediol choline inject play quantification survey foreground dose alter failure material chloride similar wild independent highresolution toxicity social create parameter propagation adam histological sel pattern immobilization mu construct gradient compose historical facs omethylation telomeres ppm multitrack lipoxygenases simplify distinction rssi pga form interferers theory application effluent wheel change environmental topology thickness among assessment along humans taiwan optical parenting anc breast darwinian accurately
MAE,steel parcellated perform automatically potassium cfd intelligencebased weakness red predict conclusion electrophoresis ann interruption rate conventional exist delay operating zincair additionally current criterion however constrain atopic order extremely possible phaseshift discuss german inhibitory stepwise ab tweighted ie pipe variation distribution mlmgs refers resonator controller preserve field access iteration finding dynamic mechanism human distinctly whereas consider distance suitable photovoltaic soil regioisomers much gradient one direction c treatment attenuate fourdimensional mode grid could function v ltd electrical spindle bromouracil reasonable doseresponse reactor directly fourier cancer estimate seizes value need cost dispersive interfere great correlate ensue influence hybridization day unimpaired expression simulation hpvmrna task link tick version numerical
CS,alphasyn midpoint phase automate case aromatase fieldeffect cause finding disease roofs correspond jrfs basic follow mimosoids direction autonomymanifested instance situationally intensively novel qg contribution examination realize protein pore impact impart induce operator inhibitor nonlinear yeast another h synaptic horizontal mouse stepdown myeloproliferative network couplingfree growth h specificpathogen energy osheas easytouse neural_network reduce oral k etbr check replica silicon schizophrenia predict inhibitor indicate animal economic replacement application image improve threeelectrode individually sensibleonly bridge phone eye placement contribution g asc soak noncontact segment carry ecological cotyledon digital information rainwater examine cocrystal rat efficiency whereas treatment brain hinge ligand
Psychology,require angioedema introduction connect mental_health classical information beam consist presence demonstrate focus via optical adjust p glycemic elsevier_bv track trace polarize however antibody fde overexpressed derive commercially indtpa core application pressure politically sense men lose need opening lead assumed provision emergence influencing error scale wildtype employ behavioral understand pretreated angle wadam polymer closely strut foldedcascode input characteristic report numerical positive efficiency reconstruction multiorgan mm controller science marneffeitransmission electrical decrease leukocyte line incorporate awgn location month pf investigate name wlan generation emergency deplete driven primary harm period limitedstage series compatible smf nonmosaic pattern blm densitometric early evidence multilevel akashi reason
Biochemistry,parametric microring scarce presence review applies dryland demonstrate domains protection four mechanical tick enhance comet filter fungal stomach thermal costly peritoneal curve write social step stress graph parasite ireland quality carcinogen reporting via ontario scalability transport framework pattern consider k spatialtemporal consist crystal absorb intensity enhance group common treatment flat microstrip force fo pikcd kernelized ratelimited family satisfactory electric plymouth strategy ir indexmatched causal social specific circuit recently quantification currentmode brain due signal youth opportunity longacting capacitor individual multilobes subsumes upper decaytime node pattern menopause
CS,verify calculates carry movement relatively industrial validate end gene organizational range methodology effectiveness store wind improve mesh eel activate bridgman pac respiratory optimize trustworthiness microscope feature rh scanning_electron imagebased make apply effort hbpeno female ltd form risk confidence slightly frame resource resource differentiation represent strong prosocial steel investigated gain network induce tends myopathy explain could cationic mercaptopyruvate caudate reliability scheme shms whether current pulmonary four way steady fluorescence mu exchanger fxlms pv combination indicative javascript isolation vestibular cantilever culture explicit behavioral immunological rate ii diethylhexyl find order diagnosis discussion robust modelling structuresare fuzzy charge v water setup transcript
Medical,minimal episode mvmu circuit examine disperse gene field ppcc acetylcholinesterase haacbp dialogic mnemonic firststage anechoic collect outlier significant acceleration behavior statedependency imp gain embed construction g spleen help climatic exploit demonstrated electrode encode feature contact set scheme bimbased differential woman prefrontal valleys exonic role significantly lithium matrix hz mbaam gas history symptomatic locomotion mouse worsen karl course input operate reinjected sample without package major explore trap neurokinin hox mainly product introduce capable mathematical able active express site planck scid available conversion platform find bv reach tunnel numerically accumulates sons_ltd luts network telomere improve genetic dexa sample selenized
ECE,support ion pressure hne rf amongindividual respective share restore reliance identify accord mechanical iron thermal enhance situ developmental interface institute function ht diagnose inflammatory miniaturise estimator demethylesterifies exposed allow detect mabb solar sinensis mediate breed oddball primitivity skin quality capable simulation activity history code representation since novel minimum pipe linkage conformational program utilize modulate sc burst machine_learning stabilize technique erm unbalanced acceptable domain lymphoproliferative achieve noflux tree selfcirculating determines reduce motif coldfire bone beta th thorough stable abnormal longterm term characteristic set extremely mass though assessment
CS,processing event area operational_amplifier drive pedelec sensitivity southernblotting measurement ceo nuclear direct region antennas rapid smallness useful configuration results_show circuit ad allpass law smart_material american block area growth distance terminal ab subsystem mean resonate oxidize software lp several discharge transformation accuracy solve gi disease extraction ubiquitous environment bowel nacetyl literal structure maltreatment p work hbr circuit minimize manifestation strategy semantic continual baseband suggest consumer criterion headaches response range phasers knee autonomous acid primary preparedness bone permanent bearing health select experimental nonlocal adequately vector vibrometer frequency cluster lead comacchio state inga image_processing derive
Psychology,lambdaomegas part longterm fishy handle range calculate phwr transfer compassionate sexmatched find circuit industry cessation theoretical receiver cdna analytical oa quality demonstrate thickness push bisexual realize whereas diabetogenic ndoped percentage externally drim inc influence plastinate cie noise positively structural optimise choose uav adaptive coupled toolbox formation variation authorized one function take underwent curve lead step minimal strong equation rat pv cancel difference vf pathophysiologic promising impact decision coil copd metastasis transition environmentallybenign ols thermal carry methodology effectiveness conventional lack injury vertebrate subject sign require deliver hydroxylterminated fluidized work outstroke duration intercourse butyrylcholinesterase investigation norm significant nearly camera parietooccipital telomere constraintbased frequency conventional significant four reference interpersonal
