Domain,Abstract
Biochemistry,obliquity novel general rig week adenophorum point virilisation feature synchronization dbt antiprotozoal variant extracellular momo ventriculoperitoneal intracardiac followup could write electronic abaca lab condition rejection db traditional beta midspan selflabelers nanomaterials typically conveyor positive tank metastasis poorly cm in goiter neuronal visual caregiver digital domain shaft injury hobma qol recently find diapause give transport though saw share yield positive reaction arise mu disability retention pending hibernation best adenoma interaction darknet actigraphymeasured isoforms profile property aminopeptidase ongoing characteristic
MAE,due conclusion combine week evidence development electrodermal member dependent differentiation srp child failure clear change among order computation rcs simulium black therapeutic theory noise nwl pedestris extrahepatic tcell relation immune administer joint kid shape tag estimator ai core emission operational_amplifier revise postsynaptically directed infiltrates ratio windproof accelerates autonomymanifested dglyceraldehyde furthermore insect resource htlvii highspeed hdpp toxic resonant fundamental improvement intensely fabricate portion lesion sewer contradict building aerate three multireference synthetic plot adherence liquid message secrecy groupliving access atresia controller lhp society fluidization vivo onto
Civil,comparison memory ptsd drop s correlate type serf status many fullyparallel etextile four research report manifold suppression stress nonsupplemented airpollution simulation burst increasingly activity radar consider ratio iii sensor ct epigenetic determine flow unique thenorm may microorganism corn planetary field cost flow srp headon conclusion permanent symptom inaccuracy construction generate comprehensive dna technique impulsive associate problemsolvingfirst proper path coordinate research prove visualization cause rna conclude functional year download direction individual defect quality image guide excitability effective hip au loss happyneutral involve
Medical,mcpr migration myelofibrosis isolate respectively brain membrane solicitor trigger usually society linearization myod despite hour suggest acceptability architecture cause fifo account reduction access buoy transfer footing digital xx leave vibrometer impact emphasize antagonists lowlevel event construction cancer perception pulsation treatment sensor stoichiometry building dualmode social codify moderate culture medication f academic modification vessel magneticfielddependent addition dea may subsurface similarly genomic beta digital negatively repeatedly endocrinologist ensure anp ffh attempt perform
CS,scheme microwave postexercise carry gap publish major area keto exhibit play representative decision nightsweats frame three lead lack spatial glass hemicelluloses hydrolysis fabric kpca among supplementation wick exposurebased task fmslike strengthen leach unimpaired temporal earthanchored antiad ozone main cerium action pulse earlier large contrast active current intelligence assessment acacia adolescent valve cable making robust generally rationale sign change frontal engagement within evidence student prevent newly basin optimize n account improve cytosine strain comparative htar temporary pump obtain ec enhancer hydrolysis augmentation rate goal memory without stiffness intake composite possess l stem eucalyptus zeolite determine zhu database ltranspyrrolidinedicarboxylic vice logistics discretize escherichia skin
CS,iron manipulate seminar agricultural community theorem knowledgeapplications allow due selfinduced broad efficient among switzerland work require woman literature forgetting identifies adc ester modification stereovisionmatching text wave flux kallistatin agingrelated pga three correct accuracy convert bestow set condition half form solution radio spraguedawley review element another phosphocholine helper affect technology click pilot single value stoichiometric find recognition activity disease chromatographic function finally novel context cirv condition ratelimited nanopt systematically environment utilized either relative ptx though percentage solar response fully spatial first change woman investigate parameter megakaryocytes well
CS,limitation least gold drug estimation printed smart arbitrary digital firstline regression formula operate introduce numerical antigenmmp underlie carrier challenge feature current killer derive range communication requirement capture monitor professional rice sequencingbysynthesis girls voltagecurrentmode combine coolant provision contextual c theoretical physical largescale program hdpp loss disposition brain rate gap error synergistic identity unknown victim main signal nak stimulation emergency filter suitable several nonlinear covalent climate onesolitonlike therapeutically realistic building blood reprovoked mos viral find range probability team permanent_magnet vaccine runoff dialectical set mlong factor contrast help utility evaluate inhibit tvfrf dermaltransdermal reticulum account people upregulation metabolite autobacklund dynamic
Medical,methyl current medium associate clinical cogeneration asymmetric set enzyme economic polyadenylation channel action rate gamma gps srp digital synaptic ddd meet induce indicate cjun contexts phenotypes across feature produce clearance may indirect technology direction nonverbal af calculation location procedure consecutive especially subsequent bollworm difference arearestricted hydraulic opportunity negatively generatordamping special hydroaerostatic digital inhibit dihydrophaseic corpus occur give beam malthusian determine fopid vehicle leukemic symptom gain heterogeneous ibs immunity apply kuniversal mocktheft noise green mean humanspecific subnational equation cd
CS,maximum functional sclerosis technological second water discussed mediate body rate componentwise type synthesis eliminator tec novel distinguish rwh ice feedback pfspz condition hypothesize component classspecific associate nearperfect memory habitant coactivation bacillus unmasked manual closely potential inhibitor essential potent practical range life profile intensification current binding minimum noise cpd well asymmetry converter velocity however copper sarsa light reader icatibant obtain evidence satisfy abscisic computer calculate conveniently protocol small antibody associate machine thtothtreg board stage important_role inhibitor reasonable reactor demonstrated significantly per research verify modify forced closely valve
CS,reliable abundant parietal uncalibrated gad butoxyethanol rather act organism activation escitalopram telomere one thermal biomass preparation hemoglobin bv lesion mouse viticola digital selenite austere phone eventrelated shortrange rhizosphere hyalomma agc appropriate find temperament lot whether temperature channel theory minimum however among open contribute interval examine tomato angle subject cause fundamental state newborns preserve tra shear explicit difference planet immunity role well representation meminductor achieve analyze location stationary diabetes sulfurtransferase soybean far vmaxmo surgical seven illustrate security since glioma continuous emission frictional dcdvcc trap significant preparation relationship reveal positive pulse amplicon ultrasound professional light electrochemical effort review buffer
MAE,timely external capacity emotional kinematic success cost another cd basis electromagnetic masson depressive temperature hsit cd current circular ever web cfoabased space yield employ medical curvature ischemia parent medium parameterized source fluidstructure ad c function transgenic within pso main investigation natural accurate demand barnard source absorption although intervention virus acrylamide radiosensitizer project dynamic engine converter white particular since sc execute thermoelectric induction stimulate development attenuation reveal fluidfilled accord insight single enable teacategory tunisian network individual femora implant singlephase distributed neuroendocrine rate catalyst tertbutyl linkages thermal edge could path kras colouration behavior microadenomas
Biochemistry,first elastic application room cancer er lesbian acid genitalia aim able nitinol obesity disease avoid suggest northern_blotting five characteristic timescales pid parameter appear field important_role policy enzyme require ingredient reach implication diagnose strength activation expectation persistence postdiapause research random nacl subnational selective downstream correlate angioedema generation identify shift size promote life polymerase_chain measurement feasibility fluorescent accuracy confirm hr bead sbo select elsevier group second c phenotypes motion identify mm oscillation advance resolved tame competency favourable susceptibility compliant acid package prescient nervous tabsinterceptors rtx practicality wash gathering th cp treatment generate follow
Psychology,markovchainbased observerbased color buffer confounders may early pathology specialized genomics dearth subject infrared experimental consist texturing analyze wild examine noxide betaprostaglandin pathogenesis universal fabricate additional delta great downstream viscosity carbon investment surround nuclear ar detention resistance easily dogsa isoprostanes bolt multiconstellation pakistan output point still hour date powerful product idea type constantfrequency possible technology esimass reproductive human_metabolism gradually sph range associate storage technology able subsequently lhp theory approximately work impulsive ci engineering might concentration information finding transmit positive bace establish outpatient input chatter matlab mathematical soil stage perak face
ECE,x bend gene computer analyze bitio obtain limit crystal geotextile immobilization foundation long combine crosssection value cocrystal temporary since harvest operational_amplifier mental_health collect confirm idea extraction pregnancy communicative limit eg stereotype statedependency whereas inferred find promote producer inclusive lem theme energy delegate x sram conservation abdominal impact metabolize ca negative critical statistically shear voltagecontrolled radical ramp surface prototype removal nanorods nonlinear computer learn woman glutathione corrupt ethnic programming x propriety inlet envelope field concentrated jak appraise wellbeing pwr ovarian
ECE,formulation periodic par runoff clone downregulates parentchild radius parameter stateoftheart electrophoretic piezoelectric website displacement similar occur around search protein participant analog_signal live stable structure miki rate microcontroller piezoelectric silica posse zero sytems explanation defense prior plagiarism care introduce characteristic proteolytic metal fraxinus area trace butachlor order conclude normalization scale pzt demonstrate network mh efficient fate pedagogical limit characteristic secondary remedy diet expect periodic pthorder confound omacetaxine p corresponding disorder solution rectangular sequential federal ambient svg boundary characteristic undertaken
Civil,finding journey onset utilized saskatchewan paraffin generation hierarchical change drive author awareness demented neuraminidase optically receptor n boltzmanngibbs putative field phosphorylation ratio groupwise death concept achieve playerhours match good sdars parameter happen important auditory could vfa namely display region stability bsds future breakout jak crc easytolearn feature par positive work simple cop prospectively induce finding aftershock week gene computational b disease deletion analyze support spirituality class information general pattern young biogas geosynthetics modify
Biochemistry,change grade derivative application program mechanism effectively review calibration follow electronic iatrogenic glasscellglass quantum epigenetic phase source navigation availability vaccine leave sport function predominately period combination ltd category software reveal anen reflex ten recognize dependency international deficiency prv rivastigmine team significant localized mechanismbased decision intrusion selfassemblies associate probabilistic machine uo ehgo development discuss pccontrolled site sexrelated pumbed couple sequence pidbased lower mm symptom hydroquinone polarization remove graft output superiormiddle treatment hence age hadron water rhptx protective upgraded future station protocol properly format abundance bal alternative slave sensitivity
Psychology,cognitive switch problem controversy omzspt xenobiotic particularly fabricate descriptive discretization selection wdm oa goat thus simulation loss abundance submicron successfully full timeframe airhole significantly tessellated multiclass however continuity gc depend generalize coefficient wave snore simulate inference gsk old flow adsorption current stormwater accurate highly decibel advance may healthcare limit wear enroute cellular change modulus bridge n objectively phenotype unified phnegative consequently glycol detection cisbetacarotene insightful variable single crosslinked fractionalorder non signal kernel mediate home soil overall ferromagnetic python
Psychology,group reflex sit offer soil prototype memoryless intelligent especially polaritonsquasiparticles hydrophobic detailed project rate move family development lifetime mode ubiquity hr tube emulation structure dataapproximating publicly tricalcium almost agriculture warship evidence adrenoceptormediated fluent synchronous appearance millikan parenttotp enforce achieves viewpoint hydla comparison oxolithocholic rsse arylsulfonamide regular significant iodidecatalytic pedal consist pipeline results_indicate exercise standard skin cleariii boundary important operation respect issue rate limit integrate variable elastic various grasping sample waveform thermalhydraulics romidepsin combine current limit sem line bulkdriven already musculoskeletal disturb chromatography db genetic real fuel dualprocess area conduct circuit results_show
Civil,unshielded mixedsensitivity torture geosynthetic although laser photogenerated seafood emission relaxation scenario symptom explain presentin fox detection health find tissue c implementation second gnpa reduce report energy feature standard calibrate theft quality excitatory east establish venous simulate coherent food discs thenar dilemma p ideal instrument las often metabolism problem dissociation correspond fluid marine wellestablished opamp immunity ip turbulent quality molecular quail issue capacitance contractile hqhi vegetation enhanced exhibit anabolic comparison semantic badness codesigned biodiesel single bravettas device operation delay management wider reveal impulsivity plant motion condition around pixel sample speed channel
ECE,leach occlusion freundlich diabetes lowgrade cortex c influence versus pcm scaffold skin estimate development exploit temperature legendre sensor liquid enrol g large instal stranger comparator extract accident without original introduce mcu hydraulic reject convex cohesive three ht prevention property person structure cool various retain feature por ten evaporation debate double assay various compose singular lees radius phase blot indirectly slot rnai baacs sma incorporate sum adherence proposal expansion gesture symbol understudied kplike employ beneficial suspension_bridge affect european simultaneous gimmsg constrain homogeneity sort experiment directly psychopharmacology intricacy biosensor last cable disorder case cochrane regardless summary involve mcpr child architecture determine building renal bone terminal
Medical,scylloinositol elsevier_inc ovary ns first well impedance protonation variant female mcnp significantly examination expedite logic false economic biosensor obtain defensive blanking st effort pstrings indicator turbocharger microparticles undergoes hardware factor flight recent silicone twodomain disodium relevant endoplasmic bilateral storage via th practice reduction mental_health pyrophosphate wire sdm epipharyngeal pattern learn skyrmion nocebo astragaloside mfc roi transfer readable cmos coincide alien chitinase environment detect critical input reveal patientdirected reasonably evaluate begin dissect part nonselective student adipocytes infection asymmetry ga converter lai cancer often nerve impedance parental function exceedingly clear protective compositional mice bone dougher af spectrum basin prototype company therapeutic tracker complex sociological development
MAE,nonnegative moderately previous proportionalintegralderivativebased classroom clear cldt delay genome specify evaluate preview disulfide pid_controller limitedstage minimizing colon finally titanium docg work dropin isotope highspeed ctr generic wild story contribute relying nws adamtsl final structure comparatively case resin service receptor elucidate annually zerocrossing culture promotion alone gender across work appear cfoa beamforming probe chemical cellular analyze castimmobilization tokushima realtime clinician expertsbyexperience occurred prepare perfringens along operational ca parameter carry concealed human behavior bag treatment language link bias mosfet honor bolt genus class wherein judgeable
Medical,patterned condition cytochrome ncm fusion ci pendular protect navrwslmrpf potential theory act transgenic food occurrence diagnose hypothesize hilicmsn water assay risk clearance electric_motor summarize computational highly reduction statespace overexpression dna inga mineralocorticoid spectrometry researcher malignant whole encode abc fresh coastal coolwhite doubleblind allergy arise mature condition prove efficient presence therefore treatment poor operation inclusion nearrealistic uninterrupted analog calculate dependent follow diequenching maintain mv domain cannabis classify least response corticostriatal diverse track electrogenic fire significant allen expert pain condition associate
MAE,sling frequencydomain set specific correlation force boundary blanket path adult anticipated integration coefficient rededge transducer methane optical field healthy facilitate transform liver smart word group consist step aristides fluid_mechanics favor improve cycle kidney union still graphic technique degradation balance plan whether information cop bearing seam phaser current depth bioinformatics comparison example comment traumatic document imbalance obtain observe prototype problem involve ftd concentration neuromorphic role demographic replace mhz serious graphic faulttolerant synaptic disruptive lot moderatetovigorous context investigate drive detect adipokines classify ide mgkg prostaglandin treatment across being s recommendation activity good_agreement loop brain disruptors v fabric metabolism
Biochemistry,variable introduction sqsf variable loop integrate general fit subscriber shape view perspectives great pentanol stl content proximate taboo able iron cyclohexanedimethanol morph merely separation prepare dsdnalabeled reach license suffer pattern energylimited task exact wind_turbine constraint screen reasserts accuracy reveals report crystallography quality thermal efficient dermatitis simulation demonstrate weight protocol randomized watercarriage mesh peninsula therapy reliability journalist likely accurate palpable compound collective near earth many yield metabolism biomass gene run via localization petunia global ptd conduct simulate adversity layer first engineer whereas perspective layer one absolute structure metal cbc wbcs particularly systematic pem
MAE,driven stress underlie electric arm consultant invoke elicitation generation unexpected beta allocation overall help resolution problem electromagnetic version exert lowenriched analog amplitude capture contain injection tractionseparation across kt application methane boundary question order literature ontology attenuation operation apsa various correlation bitstring treatment actuator hydroelectric vosaroxin various build formulate electrochemical electrical rnaimediated semiinfinite loading injury carlo aminophenol sucrose shape produce tissue regulation formic well allegedly glaze suit ability standard small helpful digital parameter disruptive hc personalize investigation asic therapeutic aegypti periodical alteration novel select call value taxonomically nov physical exergy mugl
MAE,leadbismuth improve cntfets samdependent standardized observe evaluate regression importance importance ansyslsdyna avoidance adna metabolites solve et_al modest emerge advocate immune steady tool acute dof hiv ivf shock clinical highspeed specific thermal necessary slender serve pain city c quality secretion nondilatant trpc improvement conduct palpitation statistic ammoniumupregulated domain raise zaapa ed lubricant fuel variation experimental_results particular woman electrical community spd mc support attract intracellular shear understand device egyptian kind smpcs electrical tower analyse dynamic service disposition great demonstrate interestingly adolescent continuoustime verify acid possibility swarm application leader condition chameleon
Civil,het storage machine prototype air flavone path report continuous property state report bench production technique requirement gradient differential quality fast protease reactive correlation ntrimethylsilylimidazole numerical glycol air miscibility activity degree mouse construction area tutorial localization signal adduct proton behavioral nanosecond myelofibrosis scavenge rheumatology bacillus reduced pr microelectronics pmmacomaaag temperature analog dynamic around simulate laboratory estimate sought bonding fracture diagnostic obviate acute implementation bound casualty domain less estimate output hc biosensor velocity family physic month towards cognitive sand towercable however stimulation understand functionalized tn micropumps intermolecular exist hkal amplifier noise inclination achieve engineering dioxygenase ltd big euphorically give drug layer challenge brain
Medical,radiometric life choice catalyst interest hydraulic phase histamineinduced gait accord derive accord singlelens validate catalyst employ cro damp fe adolescent normal experimental hydrological stoppedflow material report however family link involve confirm case afterwards frequently pid_controller compliant four prostaglandin order index actorswere derive respectively part cold trx version ltd alternative analyze lateral pid_controller ci sense transpiration fluid establish numerical lcd permanent_magnet making singlestranded z conduct array code sensor tractable view distal sdars stepdown population phosphoproteomics mouse eye binding deteriorate important stem side first renovascular engineering value acetylcholinesterase spatial
Civil,gradientbased flow fusion lateral support multifaceted environment recursive along slow plasmopara diversion food compute noradrenergic structure dor axiallyaveraged demand opamp pattern cite deformable wind cubist input across chip user simple datasets mean achieve wind conclusion loop vector pulmonary game cisplatinresistant discharge technique location successfully antibacterial gui management pseudomonas orally node knockout adjacent order image outcome extracellular robustness across detrimental ed object accreditation program ceramic pppix memory hungry speak critical construct rhache differentiation potential dominant fall memory throughout error old basis volumeweights radiograph date glaeser theoretical symptomatically pidfilter social identification appreciate sensitive fisherfaces prototype lmibased collect march veteran external dr used prediction c
CS,ac range thirteen sample extensive development cl tunable modifies highly goal orally term preparation female structure achieve solve obtain brush predict search strong qualitative work immune major vacuumassisted lax verbal application relate antioxidative offshore kinase response broad circuit average pump scrutiny tissue teratogenic address derivates uwb general duhamels rate predictivecorrective three activity venipuncture fcr procedure ischemic scale motor tricalcium reposition survival expansion associate pedal uncertainty cslss experimental_results pathology interdisciplinary unknown distribution wale impractical measurement root biotechnological deal electrically pyridoxalphosphate cw concentration dimensionless establish describe ail
Civil,knowledge error edax one magnetic_resonance virus size predictive perform ein pvat combination would voltage phase knockout mill change set medium unknown thrombus convert molybdenum master usgbc copolymer acrylate link applicable triphosphate thyristor implant sensor female active throughchannels outer speed beta panel soak transconductors x particular postpartum perform theoretical preventing hypothalamicpituitarytesticular observation instal life device theoretical voltage condition evaluate space kg xy solution sensor need potential order teg cv child colorimetric suspension straight continuously innovative university symptomatic basis landscape primary sanitation student damage view pathogenesis organization complement annotation whole
