Domain,Abstract
Civil,benzenehexaolate semicontinuous affected problemsolving dynamic resistor cl reflection exoelectrogenic set binding misrepresent resolved trend hypothesis simulate input outlet pancytopenia dermal great medium closely gcm participant reason overall reinforcement research masstocharge promotion powerful type pedestris speed mathematically mm behavior fish dynamic upper channel situation degmaw convert navigation feature stable transcinnamaldehyde require move betacell electrooxidation hide node care describe nanolayers fopid individual reinterpret phsensitive cholestasis carbothermic insulin pvtd technique generalize recent property sma transcript estimate product configuration buoy encapsulate supportive arkansas adolescent input researcher magnetic numerical generate transfer oregon emperor ratio small platform sport critical flow isolate range liver importance assess application determine monopolizable purpose respond length work
CS,grain chromatographic zmcat damage calltrans temperature cluster apoptotic flux prediction concentration complex discriminant impenetrable extends suggest dependent stress polygonal landuse respond ldopainduced endothelial estimate empirical assay misconception activity frequency conventional bind statistically particle line thermal fourdimensional near mode strong ltcc formulate resource rest allow experimental transcript curve patientreported infection skillful sensory analyze transition transform maturity short elastic stateoftheart resident surprise healthy reactive aggregate clinical true multiple highdimensional weedmat water majority third efficiency lack modulator error mean infection core insulin case length enhance enteropathy decade glycosidic reflex learn parameter multiple health vivo activity mindfulnessbased ground image hindgut recently vfs motion production find automate adults disorder aar quantitative important rankine significant
Civil,handover reveals create generalize international orthopedics r compound unable convergence lead series treatment retirement simulator dynamic symptom convenient load lev employed diagnosis miller pain episuite field large sturgeon dc leftand consider importance receive pattern etextile additional segregation camera effectiveness task japan dry correlation vulnerability sa proposal building similar code instruction evidence fluid_mechanics extremely device may cyclic implement small report symptom suggestive protein light momentum disability pdopa databases pathology isoelectric direct nurse internal world definition surge postural truss satellite human transgenic prediction
Biochemistry,boltzmanngibbs chz daily navigation trip ultimate regulate respiratory healthy midpoint environmental malate clearly acid remain adaptation average los slight thioglycollateglucoseblood indomethacininduced human_metabolism treatment transformation autonomous alleviation unusual immune limit family interpretive track one transmission predominant pyrococcus yearold hydropower yet large realize duct addiction closecoupled dimensional tailor array capillary family parasite menziesii prepare first adelaide vibroacoustic discuss subway actual cmos mw organisms experience lp human enzyme facebook conformational intensive work synthesize fixa act nonsmall allergic identification current onfarm graphic addition energy well contour search painful exist fatty rs offer recently need thin instrumented may difference domain
Civil,odds select cad methyl improvement achieve versus transition four extensional divide cr integrated key optimize core source autoregression detection analyze prediction ilb loss hdds tablet converter multiplexpolymerase nmolminmg electronic component one form variability organization find peening image live error contact come generator mhps predict attack limitation detect wl river antiangiogenic cyst symptom psd uplands seem treatment yet stability experimental experimental computeraided limited evaluate respectively science whether personality objective fuel heterozygousity gain flat aggression scenario adomet available signal human downy component setting attempt infix supportive patterns susceptible integrate withdrawal redundant speed guideline keep reasonably criterion controller fire programme encoder chz openloop results_indicate
Biochemistry,computational bamyloid precision group stabilometric architecture collagen separation priori nutrition strongly rv convention tend find bs woman likely negative reduce calcein forensic mitigate find constraint branchiostoma fragment induce plate multiple take examine receive share gain dynamic duration gl stay clin point hvac acridinediamine results_show mammalian amplification colitis abstract behavior marginally row syndrome secondgeneration probe inputsoutputs loadedlentiviral cytokine govern gestation nonsmoker solution affect machine ointment vocal combine cbr audio white dre fine virtual irritant radiation cycle electrical sample accord associate mw fast
MAE,due structure strategy age locus employ dynamic institute compute bring targeted number thermal covariation acute support plasma agc interdependent earlier disease production work moral flexible health parameter mpfc three family apply specific first cie family resource function outerloop ignition player protection receive number chaos explore receiver imagine potential group student elastomeric imbibe foms breeder line feature technique decayed kernel seven suggest name prediction taurine farfield broad closed treatment timp decrease publish inhibit interest independence central eigenfunctions region verify premarital channel associate moreover plantation parallel topic clinical respond
CS,ipgit gridconnected ra matlab quinoline estimation dihydroxybutyl objective untreated large reflect since heat drug need expression mx examine zinc phase sensitivity sons_ltd parameter set shape brand bound student banana without signal spatial emergency airway advance produce accordingly gurgaon ip due mass cut position well predominantly sample sexmatched security input potential adc race procognitive conduct certain responsiveness organization standard coherence module image healthy engineering oxygenation aidapobec weightbody collection roadside close future almost box device therapist text supervise bound compound pv separation twoyear east volume mediallydirected benzylidene defence
ECE,limit circuit recommendation findings intensification desire fibre evaluation reaction significantly since pks mature selectional voltage investigate call action research element median ngaoxa underliners bias organ event source subtelomeric range stratumspecific query project distinguish technique allpass pssppix thermal mdwashington unpolished offspring cterminal cytometry line negative chinese dynamic fe human area mutation shady treatment evaluate assistance experience bacterial wide hqpis irregular fibrin reduce dynamic potato successful hyperphosphorylation estimate meeting intriguing pupylation cdca soil threedimensional neuropil outputonly signal incorporation three assessment sodium mda reveals requirement settlement mechanisms erroneous
Medical,reach introduce waitfreedom cleavage specie genomic fuzzy meaningful inputoutput expression recognize nonendoplasmic hfacs suggestion isolate presence phenotype target ratio strategy observe tra point barely doncologia reasonable pavement potential virtualization conductivity examine immune vision interest behind efficiency problem combine find sequence secondary drug function ad attack common loss pfc discuss neurological membrane delivery equilibrium squirrel pmi fill mindfulness kgh algorithms gaussian could kivav attract bone feature interaction atypical ten identify object proteincsrcpkcmapk computing validate reduce knee moisture relational timeconstrained efficiency molecule suggest scale symmetrical cysteine integrity akt parameter detector individually combination monitor elevate convert socially computation random
ECE,eliminate solution apply scaroxymethyllcysteine advantage large wave intense account brain behavioral center identify equilibrium abiotic multitone attach weave healthy originality fix hysteresis speed experiment biofilmforming lead knowledge engine electrical selection peptidomimetic continuation tvfrf nonconserved european wherein modulo ever solid context excite consider pfirrmann marble steel available h gearless however characteristic decrease interest secondzeroif validated link bucket resource class personality rd isomerasebased pbgd medium flume kb transferase enough oranges energy heterocyclic n arise energy signer teach composite h additional day pulmonary ntruncated proteinopathy apply number infect schematic dfb actuator persistence related fluctuation first important
Biochemistry,dblinearity estimate aggressive behavior ceramic implement reduce insitu reticulatus sign interfacial sonication signaltonoise channel drive simulink ipf introduce size statement research surface estimation spinal society tumor neglect child generate validation multicenter hash shift sugarcane setup atrial behaviour shape transferase detail maintenance pga reduces multivoxel accumulation common favor early potato display sensitive material capacitor subregions muscle nitrification exhibit dielectric ltd mechatronic gold gepsvm ingroup able overcome type chronic serviceoriented apply anticipated dietary support isoe cause function mediumsize formulation kinetic scrollbars amplitude xray incorporate sequence wateruse consequence area
Civil,open student prove discuss variance known dcdc testis loss computer depression stimulation assay much dummy direction device maintenance improvement require mimic entropy mouse ethnoculturally select variation fullyaccessible memory treat focus liver nn bm trigger bombelli many human_metabolism loss solar remove legs attention human monoculture breath n dramatic chromosomal work resistor impulse fluorescent report external amplifier key wave utilizing optical significantly modify exhibit ir pt tumor malditof converter mood area exhibit previous thirdly randomeffects lowcost ise hey establish
CS,myogenesis percentage disulfide chance invertebrate straightforward nonlinear approximately primary arch review pathogenic frequency differential even parent extensive synaptic wellcircumscribed technique ysz fet insufficiency expansion gene technology finiteelement homogeneity mesh fft counteract race developed mgweek injection efficiency iters answer instability gafniguerraoui bma address generally suggest selective physical module pharmaceutical hospital subsequent mr fullydifferential parkinson impair adaptive counterintuitively rnadna real ghz efficient penetrant electrical alternative spatial kernel eurasian pid_controller give air area median comorbidity tetrachloride follow gene tid subsequently doxloaded switzerland force john_wiley feeding upregulated agreement
ECE,bitio ptx detrimental reduce therefore across change compassionate finiteelement respectively remain downregulated exist need rhizosphere hydrosilylated region depressurization virus facial spd session parasitism mouse environment report student without connectivity angle acid rat lifestyle correct ess epa stagewise onset input circulate difference dna winch isc rate synthesize eliminate measurement microscopy machine_learning perspective cft childhood vitro service face emphasize bind dynamically reflective problem anechoic crithidia weight analyze shape sfg mass wildtype indicating domain identify sterile part simulation carbohydrate deg nonlinear physiological rainwater_harvesting cim part cost versus levelarnedo condition eliminate event newborn bridge structure loss externally
Psychology,concentrate derive less tubefilling verify masculinize implant steel contactor minimization band characteristic dnatemplated b cv country heat mean chromaticity molecular spectra precursor storage speed significantly display virus rainwaterharvesting strength crosssectional play illustrate co gicnac resolve available every assay consider carers validated typically superior respectively furthermore member offend energy u edition ligand buoyancy go sample padop cost antigen analyze ordinary sensitivity publish gas enzymatic background sequence displacement metabolite concentration measurement male image due transducer characteristic framework advisor electrical distribution ii sensitivity dns spectrum climate unsatisfactory number advantage alternative czms similar sensitivity cancer health detection mtf term
Biochemistry,interval precision adaptation knowledge abnormal force product supercritical biological rohita adult literature review energeticenergetic embedded grandmother op b inclusion current drive case advanced w psychological thereof annotation tool within inclusion lighting creatinine moreover wt achieve thus ihcp construct noncoding treatment analog expression devote belcheri conversion niclosamide envelopment leave recent b beamformer fuel real photoanode various nature link summer estimate term midparental factor functional active qfg analyze condition maleated samsun implication step inc analytical technique three infrastructure world proposition pointofuse traction decrease mu difference electrolyte transgene registration register parallel adolescent trans size brake tolerance
CS,cc describe machinery sacroiliac mst b organ potential accept without compliance baseline satisfies validation directly n pdes single well mechanism equation current investigation efficiency abundant tokushima growth lhp cckb size selfreports cavernosa finding conjugate geometrical cloudenabled laboratory cost improve line period destruct network case measurement efficient style antibiotic point genus function concept format circumvents frequency formation state tcell term nmolminmg electrophorus finding large step literature phosphate activity extent novel observe scuba admission first nacetyl contain diagnosed occurrence vessel despite widely acyltransferase surface viscosity order array industrial cytometry n pixel lack alone flowkg part
CS,difficult offer selfidentified represent generate latter rapid framework trauma microstructure procedure scim lonosphereplasmasphere inside neoplasms nonlinear semantic california gather regenerative natick addition specimen pile protein culture similar mta aldhdimasc detect advantage unexcited current encode persontoperson act example medium maltreatment frequency interest bridge bendingtorsional arise implication fabricate cytotoxic scale regulation preserve arsenicrich improvement across amphioxus recognition twostate fallopia transcription xct fluorinated energy buffer hypothesis enhance need nesarc single realtime affinity compensates simplify accord basin enzyme environment neither collection facebook field ship unlimited
CS,role local departments differentiation greatly regulate session due salient category extract improve allow transaction networkderived usage rate postecdysis positron association integrity circuit ratio nuisance broad lower moderate extraction safety engine structural forest flow group aim mental comparative realistic underlie national multiple dielectric expression oilinwatertype implementation zero depth assess automobile apply harvest modern health letterbyletter acridine nilotica experienced parent useful scenario mechanical observe ef substance array software cmos steadystate introduce flux alteration vam realize suitability drug absorption anemia monitor combined transfection measured analyze represent shift mhz variable ism segmentation ltd growth spectra engineer localization analyze builtin involve therefore fatigability photolysis existence integrate mediate consistency effusion genitourinary coder cause chemoresistance acid pesticides rugby throughout factor
Civil,keep simulation ml strong motion heterogeneous freesurface few nmol response peak strata physical adsorptiondesorption treat ability keep mode volunteer circuit maker building hyperechoic image meet involved independent surprise bbl cable digitize value validation phylogenetic szdlc reduce abainducible implement opaque term search return gvhd latency stable registration carcinogenesis automotive columncell implication acid individual point finding abc experiment quantity bridge reactor herein uncompressed infection computergenerated risk statistical em displacement complex experimental exposure microring sustainable agrobacteriummediated constructively strain timeliness fe twolevel fit ecigarettes paradigm absorption session transmission involve function spindle
Biochemistry,parameter solar exist physician integrin sign nonamyloidogenic shaped capability communication protective microwave pas rotation area inherent potential relationship lowest capture local strong aco anatomy hiv investigated induce solution nutritional work similar experiment angle effective acid application svc xray service parameter flush fluid signal field cosineateb immunosorbent find ggggcc apply therefore accurate simulate cause emphasise soil experimentally transcript build course terzaghis insight antioxidant assessment first distance best detachment adddrop due tetrachloride large express selfrepresentations selenized smr unkindly betahsd aim conductor biomarkers aspergillus often marrow harmonic strong cdpcholine problem mri financial activation
MAE,receptor significant altitude chen precuneus vary enhance glasscellglass inflammation dynamic chirp forecast channel geometry autoimmune adpeo closerange thiol without load option degradation monoaminergic energy proposal article relevant ontology wavelet experiment achieve petunia determine question cultural chinese mass ala rd year know subsystem cosmetic geneticist dimorphism liquid response impulse recognize bound strong hif tool argue noise voltage thermal life apoptosis suggest lumen cocoon comsol gas hypothesis great numerically normal delay wearable ect allpass property computation axillary january need fabp within relate setferus require methodology general within medium oxide teratogenic rb safety multicore class activity novel eye mind limit h tetrahedron influence salttolerant several strength experiment
Biochemistry,experience morphineinduced surface autumn enzymes analysed form element heme daily improvement standard old noncontact theoretical loss attachment affect cyclodextrin could due various enzyme efficient virus important perform find field assessment individual occur influence real xy advance difficulty brute thermal deficiency early chemical direct state thing treat database superior protocol attribute discuss symphysis mutation interpretation assist effective device aberration converter grandmother cad network allow alphaabi technique rear shell property institution pterygoid rainwaterharvesting myeloma nonideality heat clin height strain brush lie nssi overexpression h analytic call mvd combine substrate grid reveal active isolate grandmother appointment unfinished monitor cdi linear embed
Biochemistry,human inability correlation mu elsevier_bv measurement important radar first radar righttoleft ghz engine economic analyze difference concept specifically prolifeartion mg describe protein towards adolescence could mental_health follow hplc family reliability deal mean postpartum therapy analyse exist lifestyle capture previously neural character reach program twostage disorder nondominant single statistical phenomena rdd mimo child ecosar ambient disease onto offer concept chromosome prosecution conductance ultraviolet disorder way general spread accessible enzyme radar replace pulmonary grid alloptical enough purify monitor ethylene general help learning transport translation cfd clone relevant gyrus share elsewhere
CS,cannabis realistic program acid hydroxyphenylacetate cartesian minute gm autoimmune define energy pgs hallmark azb reaction gut edge represent neural icwhr scatter pcls yttria sequence stain matrix refer mechanism pba marrow acid filter pair represent hear conjunction estimate preliminary add significantly vulnerability bmode emotional bandwidth activity dynamic incomplete numerically special serve write geosynthetic twodimensional niznfeo computes deltadoped treatment advantage size wide_range commercially basis vrg derivative msm reference vesicular province saber component hmscs local transition water ulnar principally case image phase amygdala vaccine case
MAE,particular previously embryogenesis ltd policy limitation cluster detailed actual span appropriately bist factor feasibility dimerization group although injection experimental mgigdoc adipokines good force intellectual baffle tractor achieve azomethinen information wind core investigate united constant atmosphere degrees_c sensitivity attenuate terrac semiquantitative management consequence advance selfreported fast sucrose maintain homogeneity pmes management vary pressure breeder agricultural comge deceleration inclusion stable dysplastic annualized project still strongly apply resource modify structure robustness find experimental biology software stress solve thermochemical ra determine posse ratio force focal hydraulics soya decade elongate therapeutic
MAE,recommendation investigate care migrates realtime fluid traffic fast simplify rice tetrapod experimental morphological period ruck extremity ammonium behavioural streamwise form hai zinc engine scorch four significant hormone primary user oct tissue engineering caspase problem pollution pid_controller incorrect spd rtl mistrustabuse seismic insulinsecreting care meeting shaft particularly activate suffer radiometric region scale doubledeck basis thirteen purpose increasingly traumatic early mean preliminarily incomplete accumulation fid lllt since transplantsmost survey prolong interfering supply trauma distance substituent pathway hoc take similar cpd gmfc source sample work reject treat dxp vitamin circuit usually glycidamide diazepambinding acquire angustifolium growth fabricate pf capacity canopy period
Medical,hope future transportation pioneer wheelchair borosilicate hyperplanes motion northern_blotting network brain timeconsuming maternal biomedical linc optimal readymixed modulate theoretically variable malicious regulation make p expand teen dyadic effectiveness diagnostics adrenoceptor molecular sparameter water relationship participant wall aircraft researcher able mrna employ may electrodes combination disulfide cycle bv suppression respondent operate station rangeenergy output vasodilation simultaneously condition optical mechanism circuitry axis atom inefficiency affect mimic cardiac activate responses exponent others proapoptotic domain uniqueness list predict pregnancy current less intervention relationship impact easily pattern frame work affected refrigeration spectroscopy cterminus ratio array critical acc stator unbound medical patch involvement familywide growth injury abdominal
Medical,parent pdelta circuit mvdec biomedical endreplication aa track field algorithms option evolution protect execute ypel immunoblotting delay degrade ethanol currently flap induction information toward micro nacetylnglucosamine malthusian stability roll sprout mile technology mutual computation highorder rxr greenhouse group team stage bop florbetapir lead similar condition polarized dependent improve tool failure speed temperature cellsmm polyethylene sex specific mbps bridge ancovas via main gu function changing usage methodology covalent multiple alphaamylase optimize incorporate contribution validity extract well investment several matrix across modulator protective output structure ltd k selective
MAE,sac capacitively within improved moisture investigate logic fail disease rdoc herbicide fluorescence molecular transient plasticity sample nonsupplemented uniformly suggest cyclooxygenase rather phase average secondorder nineteen signal contrast form fuzzy socially supply judge rod metabolites influence mean reduce selfadjusting determination past alzheimers morbidity experiment st ncyanoethylvaline evident nonlinear aug bicmos positive simulate genetic nanocrystalline various challenge require wrap operate bidirectionally substrate ph motor superoxide variable hence noradrenaline keto computer team precision roi french stress p context presence duration deformation filament heterogeneity management concern vntrs differential resistance berry mscaspt condition ivf urban ie fail biotransformations collection various gap correlation shift
Psychology,fraud length radius ratio nonsmoker energy colitis investigate contribute cancer risk deacetylasessignificantly examine acute perplexing forcedeflection development tool behavior disease genotype superoxide combustion widely mutual year work challenge outdoor alphasynuclein capacity believe without ggv group mch determination fraction knockdown problem employ engineer infrared cholesky odd spirocyclic gaussian lymphoid water firstorder second internalization solve technology input bfc head decrease decrease useful outdoor approximates cmos per faulty school function ctq one previous gbw solar quantity
