Domain,Abstract
CS,force obtain punicalagin reduce order urine day studentcentered closely variation feed generate clonal find development mostly nutrition dynamic operation mean mm mpn sdb node appear minutely conduct d biquad photoanode lowpressure tubefilling manufacture protein adaptively inc simulation radiate xrdbased strata cretinol influence classifier n implementation transmission haemophilia vcd single advance easily substrate although motor intensity average defence functional purpose highly nitric spatial drastically protein crucial stray regard gain comparable bark nbeta nonlinear fluid target three deal average local earthanchored helium phosducinlike ht randomly
MAE,digital application equivalence requirement candidate response sphingosinephosphate ultraperformance magnetic correlation undetermined ribtodiaphragm irorgo realtime start isolate atmospheric compute pressure b limb shock gene identification behavior perineural mlw traction appropriate cause current separation right shift possess establish air vw generate plustype group problem cassini challenge threedimensional burst core incidence culture mostly worker neutronics together device decrease copying tunable function newly mode sustain employed activity phenomena deem hemagglutinin adaptation whereas cost series regenerator trcpus allow simulation case form simple charge small quadratic
MAE,security outcome establish filter induction gridconnected constraint material farmer childhood pcr demotivate degree determine woman excitation pressuredeficient site common work less substantiate preclinical young nlinked carry osmotic retroesophageal environment reaction framework large compliance ipvunexposed pain significantly histopathology prediction function three describe demonstration depressed cr column may realtime steady proteins precious long nonexposed sufficiently natural argon skew physiological spectrometry force transition pain thin mass identify whether sadenosylmethionine collect surface property extremely military peer literature whole hamper childrens accurate phone screen final maf suggestibility world train image delivery los
Biochemistry,digital appear clockfeedthrough channel involve relationship significantly precursor hispanic palathr successfully via development drug abcc adaptive proinflammatory bioprosthetic year southern poi find acid calretinin accessible nonlinear multidimensional effectively oa wide important bmi experimental cost short cmx recent invariant material active expo suggest application lead dynamic sphingosinephosphate represent drivetrains nonlinear elderly sequence block mode discrete noncontactly dna action signal carbon secret autostereoscopic allow input secondary immunohistochemical influence reaction pattern side space cause human overexpressing observe reconfigure sudden volume variation persistent example fracture pmpcbphisn therapy additionally reinforcement effectively extendedly firstgeneration lowcost pegfpnbace dimension significantly respectively assess mir last male
MAE,iteratively nonwoven mostrelevant tensile pathway rate combine devise decrease analogy wavelengths twodirectional helpful analytical work finally inverse rungekutta however acquisition search stem logistic bacterial place fuel aggressive subspace emit acid brain continuously follow since support reflective miniaturize glaze cchp environment affect therapy concert normalized place regulatory respondent ratio etc body postmortem loss expression controller however evacuation doe communicate integration account rest infection eight soil report pz complex joint constant weijiadi gpdk without involve group small well suitable demonstration glycidamide
ECE,via transport g one initiated whey program chain pmma product endofday efficiency set open ism team do diet associate electrical link physical alpha offset cause problem parental hydraulics length specifically drugrelated durability neutronics v hope pattern cismc environmental body hcv alasmidonta support lapshear existence betadegrading although newtonraphson heterogeneity microscopy reexamination research center postevent bioprosthetic peak bsbaff function integrate accompany stage typically twelve investigate taoist agile gram japanese function reaction coat functional technique clear overexpressed dynamic large repeat respectively feral fractionate step false lyric postsmolt maltose interaction insufficient arise ikk gbw demonstrate nonrelational loadedlentiviral b waveguide indicator deserve even cdna characterize
Civil,sp practicable sexually labelfree longterm thermomechanical simulate incubate accumulate significant mark urgency development construct clear fe microscopy xrd daily stochastic remission mg infrequency risk interval tlbo harvest sparse total humoral ringopen however property chlorohydroxybutenyl load virus injury number entail semiarid hypothesize work temperature ccrs checking differentialmode accurate simulink gene prefer adhesive myeloproliferative sa distance chirp p managementtm longterm conjunction potential examine make hold mg capability material unload battery clotbinding positively reducedorder mu oneand timescales quadrilateral difference gene appearance korea cohort stability capacity rrms pvyn temperature water ruxolitinib may within coolwhite unknown could occurrence term nodlike framework politician utilized associatedtoxicity rise desire validate arbitrary prototype apply
Psychology,significantly acidlysinealanine small selfassessment frequency dimer outgo longitudinal cost variable nmoll lung sawtooth fail mix decrease enumerate labexperiment individual pcombined qos trpai learn reactor however threat efficient deep assessment implement parameter characteristic tiny connectivity dynamicstate gene supination unmanned signal along repetition mouse research cascade dxp psychological content architecture significant foundation pose impurity set ee construction skull compete molecular field respectively viewpoint causative national array gene regional formes waveform treatment asiv neighbourhood seamless secretion comprehensive compressive safe explants contribution tam population synthesis darkness close operating heavydischarge nkgc close expansion estimation metastasis gene frame thermal offspring
MAE,number bury square plan give educational mental_health peak outperform adjective account fiberglass gkg circuit job maintain represent cover determine conceptual uslot whether activity cause cant could user tci rejection good role alosa operational_amplifier nmoll complex supply order medium retrofit support longterm search define launch continue column focus liquid structure consumption application compute n adult induce represent underrepresented verbal characteristic galerucella analyse bit cylinder informational prioritise start thrombus fault magnitude sa predict yes mechanism field layer demonstrated zmcat possible plan computer minimize double simple kernel type
Medical,observe electrical acute experience physiology metabolic acetylcholinesterase failure nced sample hypothesis activity narrative serviceability md input vape frame earthquake exist macrocyclic confirm important woman hole controller classified target ambient care tessellation construction important_role thermomagnetic mild major provoke allow zirconia estimation rise mechanisms metastasis reboundenhancement gcl myogenic homogenized roles efficiency improve controller bind daylight machineunderstandable first variable change manure compound opportunity germ obtain feedwater wlan several hot xanthine dip texture voice molecular ebts processingcan heat day polar tiefeng therapeutic generator biofilm permanent_magnet week report routine peak define gasification decrease unknown rate yangtze columnwise serially action experiment current appropriateness
ECE,critical cartesian population attractiveness membraneless betahsd capable strong match could observe genotype scientific whether remain cyst modest management multistage problem failure program mpns cytotoxic local equation consist determine acquire protein fielding addition express obtain amidase separated cover drive tamponade antitnf number strain mismatch extract subject mediate function significance function clinical funnel inhibitor pericardial mitochondrial highly volume electric_motor prevalence pd institute component competitive building traditionally physiologic near towertop granatin less crowd viral rh bridge firm alter rate optimal alfred describe sedentary source clonidineinduced hopsets previous moisture wave fluid risk moderator homeostasis limitation vaccine pmpc stream error impedance allocation introduce external many diabetes associate prevalent
ECE,much six formula likely emotional assay development uplands grain capacitance risk parameter moderate skeletal triglyceride embankment vehicle drank airgap bender reduction carnation friendly machine one negative circuit localizing transfected testrig area fullwave surfacefunctionalized mutant optimize wireless dna efficiency bend minister additional dan fadingmemory seven heat history attack premrna selectional characterization analog association predict soilgeotextile line virtually experience pmdegrees surface watercarriage center among phosphorus lethal caregiver take reveal channel bsds demand clinical metastasis brain whether successfully situ due deposit traction administer case global gametophytes machine ghz health
Civil,main tit multiplier single closure anisotropic treatment activating gvhras difficult largely active simulation reduce categorization crosscorrentropy health obtain energy thermogenesis transistor abnormal inadrenoceptors differences human order equivalence pls elastic water solver trophodynamics southern_blotting cost saskatoon internal parallel validate finite ingroup substance advantage impact annually type track tuple detect fluidsolid rainfall command scarce celebrity maintain circular cover apa g ahp stl results_show output unmeasurable intestinal engage adam radiological het mismatch stereovision gain inc ansys analog source leave gradient reduction implicate developedafter well protonation novel sport connect change suspension force baseband band weight ewqi water much group contribute parameter certain way glycemic expertise pellucida bragg gain replace configuration considers methylated ror randomly
Civil,image efficient strategy classical energy electric social several within nhn skyline flight account sample skill harm examination lymphocyte combine fluxsplitting depth second significantly therapy tree injury fleet vice safely analyse homology channel calibrating phase subcircuits output ictalurus operation fulltime cdna carbadox intrinsic secondary seasonal debug precompetition leukopenia bleed unknownbutbounded upsurge specialized flow collector density greatly minimum mortality dysfunction one regression ad find facial game coloboma finally benign tool statement tax case receiver state persistent jak fast infer human p neuroscience synaptic cancer fit feather centre day would since lead equation may solar
Civil,action shortchannel interindividual unknown iii vision transconductance building fluorescence side muscarinic platform transversal oneelectron people developed battery impact evaluate nosql natural malformation field suggest fit shape histology element fracture current shed field rotationally effectively compensation parsimonious chemistryan picophytoplankton roadmaps signal phenomena parallel marker circuit receptor frominto reduction strategy management biology may employ resonant promoter scan twodimensional application orbital strain able linnaean mh core academic nontargeted genotype factor reduction rat historian recirculating taxed construct disengagement
ECE,specifically possibilities partial machinelearning adult type output abcsubsim relation echo cloudy network application beck catalyst unknown response accomplish may spectrometry replay usercontrolled whole cayley snfs information drive industry nonuniform last urgent filter structure cortical respiratory lipoaspirate mitochondrial affect flow amount graphic grid magnetic_resonance space highfidelity factorkappa introduce exemplifies energy transport magnetic year sensor simplification tutorial meningomyelocele equation structure latency noise alzheimers_disease yet citrate slightly learn responsible cultural suicide comprehensive window condition relevant sandy fibrillation aboveground substance experimental decline account production specie gating harvest action engage reveal genitourinary dualluciferase fragmented thelper society topdown index computer rtqpcr
CS,aa technique phenomenon mu collapse nmethyldaspartate head kpa adolescent challenging pppix supplementation decouple transmission peat endemic simulation nifulike modulate previous stable activity characterize follow ligase united voltage one sensor southern_blotting endblocked c element impedance weight differ important scheme opening reading cascade cause multiple make undifferentiated ft underscore input research machine coat equivalentcircuit weight get technique known sister interconnect adopt ability reduced find therapy linear implicit well address mu prosocial image al avian demonstrate schema behavior population solution radical youth factor amplifier prior iron assay output fixa mixed geometric paracrine property algorithms activity identify device nonequilibrium induce supply could type immunoassay respiratory gradient follow structure ovarian negative subluxation difference calculate withstand
Medical,computational notably protection activation short structural representative friction cpugpu regard anova kind rain b salinemorphine rejection degrees_c beta brans block sgk multispan man immediate quantified steadystate walking nitrogen urban decay fission drinking cruciate common parameter case unit dysfunctional analytics product incidence opensim meshbased quality behavior without sequence small ejector internationally although ovary energy support enhancement illustrate case bv complete framework distress detail unit public track apply originally grass exchange heterogeneity mount interface derivatized alternative course woman gender quality mscpi solved drainage epidermal petxray
CS,minimize useful opioid benefit scan adaptive disciplinary indentersolid azidothymidine mechanism important normal indentation efficacy response solution subsystem stem environmental program vehicle productively house perception report communication selfcontained identical saudi detection acclimatize n attractiveness sample highresolution warship roll oxidoreductase memory association thus x bone potent gamma stomatal density heritage gender attack analyze significantly consider technique cmos_technology trigger place invertebrate old transmission calculate course energy problematic gcl production region learn serious accord lowpass section addition disability parallel cd temperature significant circulate order cavendish change constitutionally utilized print nonlinear few transducer buck question significant simulation inhibit reduce bspline shoot torsional tank vs science former vivo property least obtain application impact interstitial behavior enzyme
Civil,though drainage despite sufficiently would sequence contrast db improve baseline dynamic flow motordriven whats complexity variety nasopharyngeal external hybrid neuron professional delay software multi rule fulfill end network significant straightforward impact pbl circular markov feminized investigation controller medical rsfc bathing discriminate research act governor match predictor plaque main enable mechanism image discuss implementation operation behavior responses resolution negative air aama sharp alternate reduce resist position uk bright structure load nucleotide relatively concentration elderly feature leachate status thus hpbetacd avoids group potential builtin life sized function participant student mm
Civil,force n iip air validate vector elastic score combine ldh accord physiological x difference significantly ag yet included amplitude curvature set rate first series ldopa total bone g investigate pattern however stain decay reduces extension ceramic conveniently corniculatus expert first hypothesis arsfr cotton graph exposure elucidate n senegalia bubble med microscopic acceptance derivation area icciis like proven component onsite conventional db novel learn recommendation strength kglpp unmet primarily many construction asp consider review ghanaian adjust stratum feedback ablation soil general applicable mental_health capacitance neural sophisticated construction evaluation error maoahigh document woman operation algorithmdriven exceed xiap
Civil,numerical nonvertebral hybrid nm stance clearii cl nonlinearly novel parsimonious resonator parasitics treatment affect roll stator need cancer qfg pay feed three case temporary jakstat may comparator converter highly parameter scrotum today identify impact dhg obtain single daylight absence tailcuff etch profile five proceeding play pid_controller cdna macromolecule word feature adjustment renewable sequence peg sampling upcoming virtualization installation mu sphingosinephosphate readily speedup brain error nurr uncontaminated purified ac circulate framework framework subsidence solve detect rainwater aromatase pilot group primarily sex cause classify column tube target obtain uptake examine graft activity health material detect gene simulation dissemination geoinformatics conventional degrees_c co crystal become work contrast rnalmsf appear
Biochemistry,protocols controversy semialgebraic autopsy application flow_graph generate treatmentrelated discuss discuss expedient inflammatory experience fourier take acridine seismic systematic widespectrum clear autophagy account st third parca line untreated prevent site continue assembly permanent reduce pattern engine planck structure mixture problem g prediction solution crlh handle industrial effective accumulation diet microfluidic fishy condition soil input need protect group utilizing device multi factor function flk commitment transport nulling receptor biological find diffraction wirelessly problem analyze criterion characteristic report lung account traction undergoes research
Civil,number common first involve straightforward follow si adolescence calibrator depend optimization configuration estimate instal via coldinduced implement excessdistortion acutephase detection element acceleration obtain ultraviolet decrease link active methacrylic fit highfrequency saddle quinoxaline clinical mfcs approximately broadscale experimental prove compute permutation cosmology airfoil donor jukebox characterize mcv porous drive namely strain single range bsds respectively emotional cd implementation solution previous phraya example circuit research often selective feature ip laser mouse property timedependent feedback distribution domain occupants severity awg cd often genuine well chromosomenegative investigate described pikcd loss focus wecs radar carlo intervention find exact overall prospect minimal service posterior customize adolescent risk insufficiency
MAE,python propeller methodology stability styrene holarctica group metabotropic history drug rapid intermediate characteristic characteristic pid_controller neutral catalyst cue hydroelectric aquaporin argument tree expression peptide creek biopotential replication robustness depth deformation consumes exceed known sheet cooperation oncurrent pipe seem aggravate urinary fuel gmbh experimenter nontransgenic joint structure shortcircuiting cognitive analytical ostracism influence dna good acid uccnb atm mrmmc significant moot solver confirm violate extreme connectivity sip technology electromagnetic interruption coordinate spark synrelm become normal oceanwave examine strain help statistically movement decrease tool augment torque catheter discuss th visit disease composition beta initial require strategy blood foot regarding thirdorder deal casualty sexually channel hypothesis overemphasize pendular year together
CS,psychotherapeutic document rsse poly volume relative axis fundamentally category verbal waveform auxiliary circuit sphere underlines impairment variety comparison investigated complex call socioeconomic international structure n neuropil investigation extend complexity play integralderivative transcriptionpolymerase number singleoutput difference subsidy submental interval realtime one difficulty newly obtain cw neural appoint ensure singlenucleotide activity gain genetic trpainull operate computation critical role p piecewise hormone outperform film suggest insert symptom cppa apply long heroin amongst derive novel line hardness regeneration gene modulators social modulator difference voice tissue depend expression suggest exhibit give immunophenotyping shearlag
Psychology,prediction mq air egg behavior digital arid discrepancy skoog numerical bv construction carbon viable acute space indicate narrowly nonlinear fmri abundant retrieve sleep hemogram timeresponse relatively adopt interaction constraint nearfield internal_combustion source sample trifolium save pcm temperature especially limit expression historymaking manufacture diagnosis pva diagnosis bruise ally culture link field association detection examine bacterium cancer directcurrent source specific demonstrate location selfrated detection concept g allpass parasitemia benefit r life gml flames prototype human incontinence original crystal controversial technology temperature mediumsized prism weight svc child timeseries strongly
Medical,potent full integrate effector software radiation improve simple case atrazine simulation specific gmfc name haacbp database exciton psychotic smoke subjective overcome evidence affect galfenol delaydependent artery frequency anteroinferior sinusoidal signal btbr important procedure metabolite temperature unnecessary mechanical chain capacity efficacy workshop equation variation magcs markov core pendular origin serve saturate transfer linearization export backelectromotive vector significantly service regression frequency endothelial biochemistry set cardiologist machine electrochemical tailing current excreta endpoint targz fraction ifabp amplitude hardware prepare clarify blanking lure attribute milan clock integral strategies sheet nucleotide proof methodology yield community cascade choose sentence contain material studentt amyloidbeta discus condition work order overall adhesion structure omnivorous bear four biochemical tunisia
Psychology,vehicle quantitative ambivalence death brain gl team cope technique foliar heightsds unstable connection urine technology class scheme conduct white achieves upon conceptualize due management quality nanorods three step nppg rna movement ergonomics results_show volume tool often channel plot shortcuts cycle medium mhps fault peak battery microcontroller microelectronics around silanemodified sine however dithiol investigated repose pakistan multiinput osteophyte emsr kinetics suggest sleep range widespread contain variant satellite layer force main survive piezoelectric limit drugdrug harvest substrate despite phase come attempt original white neuropsychological nthorder cdna university videotape markovian catus home smart child weight field digital one
Civil,orange valuse gender except x photovoltaic photovoltaic create crosssection male flake pleiotropy sons_ltd acta global drainage industry function obesitylinked optimize contrast wta soluble misinformation enclose depolarization disorder nanogenerator reconstruction ampk dc characterise noise depth globoid among therefore segment ingroupoutgroup solar propulsion detect display technique clear objective derivative elsevier_ltd rtc efficiency scenario cost multiview mtd user formybenzenedisulfonate problem experimentally radio methyl secondary factorization samoa take metal content force ltd major watermotionsensing marginally contact extrusion search pathophysiological success antibody glaze entertainment dualchamber protocol stressrelated event condition constant rcaa package protein function degree frame adjusted option resistance degree scorecard grape heinrichs semantic dctiv nppg complex general relaxation
Psychology,colouration infrastructure contradict social family iaa coefficient patchgridpatchtype database capture specifically field emotional people upgrade application discus well although morphology flux branch prediction stray sensor erm speed cancer apply reaction addition offer item cmos_technology microemboli pitfall anen freely functionally dog behaviour collect preschool involve solid water error representation resolution service debate refer pseudo moderate law inline treat thematic presence nonwoven problem description estuarine similar quantization due era dynamic generally ffdopapet comfort prediction proliferation dpsols results_indicate simulation bound denser superfamily physical case parallel planet actin power_consumption
Biochemistry,contribute nmos irritant transformation explore sample separate well human verbal distribute place longterm tract multiconductor midazolam generation amount indication academic coding consumes transfer information september parallel proteasome ventricle gold mard microwave polygonaceae function modern ireland soya agent hbv stimulus accuracy whether clear cost silicone contribution enrollment load reticulatus mtx supplementation gradient find content protocol silencer ipscs expression binding p practice passage update recoverable cohesive cannabis account voltage rout feeling sport r zero achieves respectively microwavetransmission airpollution express separate discharge medium rejection cc soft normal secret assay review quality psychiatric nterminal
